<?xml version="1.0"?>
<!--   xml xmlns:xsi="http://www.w3.org/2001/XMLSchema-instance" xsi:noNamespaceSchemaLocation="zcouplage.xsd"> -->
<zcouplage
    DevModes="prod"
    context="web" >
     <virtualviews-package>

		<virtualview class="org.zerocouplage.web.manager.ZCManagerWeb"
			context="web" />
	</virtualviews-package>

    <!-- mapping   package -->

    <mapping-view-bean>

        <mapping
            isSame="false"
            ref-bean="UserBeanIn"
            ref-view="viewI" >

            <key
                beanProperty="nom"
                viewProperty="firstName" />

            <key
                beanProperty="prenom"
                viewProperty="lastName" />
            <key
                beanProperty="age"
                viewProperty="ageout" />
            
            <key
                beanProperty="dateanniversaire"
                viewProperty="birthday" format="dd/MM/yyyy"/>
            
               <key
                beanProperty="taille"
                viewProperty="tail" />
 <key
                beanProperty="question"
                viewProperty="questionout" />
  <key
                beanProperty="file"
                viewProperty="fil" /> 
               
        </mapping>
    </mapping-view-bean>
    

    <!-- validators package -->

    <validators-package>

        <validator name="valForm"  typeVal="file" valueTarget="ZC_val.xml" />
        <validator name="val" typeVal="file" valueTarget="validate.xml" />
            <validator name="validator" typeVal="class" valueTarget="org.zerocouplage.test.web.validateClass.ValidateForm" />
    </validators-package>

    <!-- beans-package -->

    <beans-package>

        <bean
            name="UserBeanIn"
            class="org.zerocouplage.test.web.bean.userBeanIn" />
    </beans-package>

    <!-- Business   package -->

    <business-package>

        <business
            name="processing"
            class="org.zerocouplage.test.web.action.ProcessForm"
            method="process" 
            pageError="error"
            >

            <bean-ref ref-bean="UserBeanIn" />

            <validators-refs>
				<validator-ref ref-val="valForm" />
				<validator-ref ref-val="val" />
				<validator-ref ref-val="validator"/>
			</validators-refs>

            <view-results>

                <view-result
                    name="success"
                    bean-result="out"
                    ref-view="viewR" />
                
            </view-results>
        </business>
    </business-package>

    <!-- Views   package -->

    <views-package>

        <view
            name="viewR"
            method=""
            methodError=""
            target="hello.jsp" />

        <view
            name="viewI"
            method=""
            methodError=""
            target="index.jsp" />
        <view
            name="error"
            method=""
            methodError=""
            target="error.jsp" />
    </views-package>

    <!-- Add  packages  here -->

</zcouplage>