<?xml version="1.0"?>
<!--   xml xmlns:xsi="http://www.w3.org/2001/XMLSchema-instance" xsi:noNamespaceSchemaLocation="zcouplage.xsd"> -->
<zcouplage
    DevModes="prod"
    context="web" >

    <!-- mapping   package -->

    <mapping-view-bean>

        <mapping
            isSame="false"
            ref-bean="UserBeanIn"
            ref-view="viewI" >

            <key
                beanProperty="nom"
                viewProperty="firstName" />

            <key
                beanProperty="prenom"
                viewProperty="lastName" />
        </mapping>
    </mapping-view-bean>

    <!-- validators package -->

    <validators-package>

        <validator
            name="valForm"
            typeVal="file"
            valueTarget="ZC_val.xml" />
    </validators-package>

    <!-- beans-package -->

    <beans-package>

        <bean
            name="UserBeanIn"
            class="org.zerocouplage.test.web.bean.userBeanIn" />
    </beans-package>

    <!-- Business   package -->

    <business-package>

        <business
            name="processing"
            class="org.zerocouplage.test.web.action.ProcessForm"
            method="process" >

            <bean-ref ref-bean="UserBeanIn" />

            <validator-ref ref-val="valForm" />

            <view-results>

                <view-result
                    name="success"
                    bean-result="out"
                    ref-view="viewR" />
            </view-results>
        </business>
    </business-package>

    <!-- Views   package -->

    <views-package>

        <view
            name="viewR"
            method=""
            methodError=""
            target="hello.jsp" />

        <view
            name="viewI"
            method="createGui"
            methodError="processError"
            target="org.zerocouplage.test.desktop.view.UserView" />
    </views-package>

    <!-- Add  packages  here -->

</zcouplage>