<?xml version="1.0" encoding="UTF-8"?>
<zcouplage xmlns:xsi="http://www.w3.org/2001/XMLSchema-instance"
	xsi:noNamespaceSchemaLocation="zcouplage.xsd" DevModes="prod" context="desktop">
	<virtualviews-package>
		<virtualview class="org.zerocouplage.desktop.manager.ZCVirtualDesktop"
			context="desktop" />
	</virtualviews-package>

	<!-- Mapping package -->

	<mapping-view-bean>

		<mapping isSame="false" ref-bean="BeanUser" ref-view="viewFormCandidature">
			<key beanProperty="nom" viewProperty="firstName" />
			<key beanProperty="prenom" viewProperty="lastName" />
			<key beanProperty="dan" viewProperty="birthday" format="dd/MM/yyyy" />
			<key beanProperty="email" viewProperty="mail" />
			<key beanProperty="civilite" viewProperty="civilite" />
			<key beanProperty="nbAnneeExp" viewProperty="nbAnneeExp" />
			<key beanProperty="natureDemande" viewProperty="natureDemande" />
			<key beanProperty="Cv" viewProperty="cv" />
		</mapping>

		<mapping isSame="false" ref-bean="AdminBeanIn" ref-view="viewAuthentification">
			<key beanProperty="login_admin" viewProperty="login" />
			<key beanProperty="password_admin" viewProperty="password" />
		</mapping>

		<mapping isSame="false" ref-bean="BeanUser" ref-view="view5">
			<key beanProperty="idUser" viewProperty="idCandidat" />
			<key beanProperty="path" viewProperty="pathCv" />
		</mapping>

	</mapping-view-bean>

	<!-- Validators package -->
	<validators-package>
		<validator name="val1" typeVal="file" valueTarget="Recrut_val.xml" />
		<validator name="val2" typeVal="class"
			valueTarget="org.zerocouplage.application.desktop.validateClass.RecrutValidation" />
		<validator name="Adminvalidator" typeVal="class"
			valueTarget="org.zerocouplage.application.desktop.validateClass.AdminValidate" />
	</validators-package>

	<!-- Beans-package -->
	<beans-package>
		<bean name="BeanUser" class="org.zerocouplage.application.desktop.bean.BeanUser" />
		<bean name="AdminBeanIn"
			class="org.zerocouplage.application.desktop.bean.AdminBeanIn" />
		<bean name="PathBean" class="org.zerocouplage.application.desktop.bean.Path" />
	</beans-package>

	<!-- Business package -->
	<business-package>
		<business name="Formprocessing"
			class="org.zerocouplage.application.desktop.business.RecrutBusiness"
			method="Formprocess">
			<bean-ref ref-bean="BeanUser" />
			<validators-refs>
				<validator-ref ref-val="val1" />
				<validator-ref ref-val="val2" />
			</validators-refs>
			<view-results>
				<view-result name="success" bean-result="userout"
					ref-view="viewFormResult" />
			</view-results>
		</business>
		<business name="processingAcceuil">
			<view-results>
				<view-result ref-view="viewAccueil" />
			</view-results>
		</business>

		<business name="processingToFullDB">
			<bean-ref ref-bean="AdminBeanIn" />
			<validators-refs>
				<validator-ref ref-val="Adminvalidator" />
			</validators-refs>
			<view-results>
				<view-result ref-view="view7" />
			</view-results>
		</business>

		<business name="processingToForm">
			<view-results>
				<view-result name="success" ref-view="viewFormCandidature" />
			</view-results>
		</business>

		<business name="processingToAuthentification">
			<view-results>
				<view-result name="success" ref-view="viewAuthentification" />
			</view-results>
		</business>
		<business name="processingEmpty"
			class="org.zerocouplage.application.desktop.business.RecrutBusiness"
			method="processTODB">
			<bean-ref ref-bean="AdminBeanIn" />
			<validators-refs>
				<validator-ref ref-val="Adminvalidator" />
			</validators-refs>
			<view-results>
				<view-result name="success" bean-result="adminout"
					ref-view="viewEmptyBD" />
			</view-results>
		</business>

		<business name="showCv"
			class="org.zerocouplage.application.desktop.business.RecrutBusiness"
			method="openFile">
			<bean-ref ref-bean="BeanUser" />
			<view-results>
				<view-result name="success" bean-result="result"
					ref-view="File" />
			</view-results>
		</business>


		<business name="deleteCandidat"
			class="org.zerocouplage.application.desktop.business.RecrutBusiness"
			method="deleteCandidat">
			<bean-ref ref-bean="BeanUser" />
			<view-results>
				<view-result name="success" ref-view="view5" />
				<view-result name="failed" ref-view="view6" />
			</view-results>
		</business>

		<business name="return">
			<view-results>
				<view-result name="success" ref-view="view4" />
			</view-results>
		</business>
		<business name="bdVide">
			<view-results>
				<view-result name="success" ref-view="view6" />
			</view-results>
		</business>

	</business-package>

	<!-- Views package -->
	<views-package>

		<view name="viewFormCandidature" method="createGui" methodError="processError"
			target="org.zerocouplage.application.desktop.view.FormCandidature" />

		<view name="viewFormResult" method="createResultGui" methodError=""
			target="org.zerocouplage.application.desktop.view.FormResult" />

		<view name="viewAuthentification" method="createGui" methodError="processError"
			target="org.zerocouplage.application.desktop.view.Authentification" />

		<view name="viewAccueil" method="createGui"
			target="org.zerocouplage.application.desktop.view.Acceuil" />

		<view name="view5" method="chargertableau" methodError=""
			target="org.zerocouplage.application.desktop.view.DataAccess" />

		<view name="view7" method="creatGui" methodError=""
			target="org.zerocouplage.application.desktop.view.DataAccess" />

		<view name="view6" method="createGui" methodError=""
			target="org.zerocouplage.application.desktop.view.BdVide" />

		<view name="view4" method="createGui" methodError=""
			target="org.zerocouplage.application.desktop.view.Acceuil" />

		<view name="File" method="createGui" methodError=""
			target="org.zerocouplage.application.desktop.view.ShowFile" />
	</views-package>

</zcouplage>