<?xml version="1.0" encoding="UTF-8"?>
<zcouplage xmlns:xsi="http://www.w3.org/2001/XMLSchema-instance"
	xsi:noNamespaceSchemaLocation='zcouplage.xsd' DevModes="prod" context="desktop">

	<!-- virtualView package -->
	<virtualviews-package>
		<virtualView context="desktop"
			class="org.zerocouplage.desktop.manager.ZCVirtualDesktop" />
	</virtualviews-package>

	<!-- Mapping package -->
	<mapping-view-bean>
		<mapping isSame="false" ref-bean="UserBeanIn" ref-view="viewI">
			<key beanProperty="nom" viewProperty="firstName" />
			<key beanProperty="prenom" viewProperty="lastName" />
			<key beanProperty="dateNaissance" viewProperty="birthday" format="dd/MM/yyyy" />
			<key beanProperty="age" viewProperty="age" />
			<key beanProperty="taille" viewProperty="sizee" />
			<key beanProperty="question" viewProperty="question" />
			<key beanProperty="file" viewProperty="fil" />
			<key beanProperty="list" viewProperty="listToString" />
		</mapping>
	</mapping-view-bean>

	<!-- Validators package -->
	<validators-package>
		<validator name="valForm" typeVal="file" valueTarget="ZC_val.xml" />
		<validator name="val" typeVal="file" valueTarget="validate.xml" />
		<validator name="validator" typeVal="class"
			valueTarget="org.zerocouplage.test.desktop.validateClass.ValidateForm" />
	</validators-package>

	<!-- Beans-package -->
	<beans-package>
		<bean name="UserBeanIn" class="org.zerocouplage.test.desktop.bean.UserBeanIn" />
	</beans-package>


	<!-- Business package -->
	<business-package>
		<!-- <business name="processing" -->
		<!-- class="org.zerocouplage.test.desktop.business.ProcessForm1" method="process"> -->

		<!-- <view-results> -->
		<!-- <view-result name="success" ref-view="viewR1" /> -->
		<!-- </view-results> -->
		<!-- </business> -->

		<business name="processing"
			class="org.zerocouplage.test.desktop.business.ProcessForm" method="process"
			pageError="error">

			<bean-ref ref-bean="UserBeanIn" />

			<validators-refs>
				<validator-ref ref-val="valForm" />
				<validator-ref ref-val="validate" />
				<validator-ref ref-val="validator" />
			</validators-refs>

			<view-results>
				<view-result name="success" bean-result="out" ref-view="viewR" />
			</view-results>

		</business>

		<business name="processing2"
			class="org.zerocouplage.test.desktop.business.ProcessForm1" method="process">
			<bean-ref ref-bean="UserBeanIn" />
			<validators-refs>
				<validator-ref ref-val="valForm" />
				<validator-ref ref-val="validate" />
				<validator-ref ref-val="validator" />
			</validators-refs>
			<view-results>
				<view-result name="success" ref-view="view1" />
			</view-results>
		</business>
		<business name="processing3"
			class="org.zerocouplage.test.desktop.business.ProcessForm1" method="process2">
			<view-results>
				<view-result name="success" ref-view="viewI" />
			</view-results>
		</business>

<!-- 		<business name="processing3"> -->
<!-- 			<view-results> -->
<!-- 				<view-result name="success" ref-view="view2" /> -->
<!-- 			</view-results> -->
<!-- 		</business> -->

	</business-package>

	<!-- Views package -->
	<views-package>

		<view name="viewI" method="createGui" methodError="processError"
			target="org.zerocouplage.test.desktop.view.UserView" />

		<view name="viewR1" method="createResultGui" methodError=""
			target="org.zerocouplage.test.desktop.view.UserDisplayView1" />

		<view name="viewR" method="createResultGui" methodError=""
			target="org.zerocouplage.test.desktop.view.UserDisplayView" />

		<view name="view1" method="createGui" methodError=""
			target="org.zerocouplage.test.desktop.view.Redirect" />
		
		<view name="error" method="" methodError="displayError"
			target="org.zerocouplage.test.desktop.view.ErrorView" />

	</views-package>
</zcouplage>