<?xml version="1.0"?>
<!-- xml xmlns:xsi="http://www.w3.org/2001/XMLSchema-instance" xsi:noNamespaceSchemaLocation="zcouplage.xsd"> -->
<zcouplage DevModes="prod" context="web">


	<!-- mapping package -->

	<mapping-view-bean>

		<mapping isSame="false" ref-bean="BeanUser" ref-view="viewFormCandidature">
			<key beanProperty="nom" viewProperty="firstName" />
			<key beanProperty="prenom" viewProperty="lastName" />
			<key beanProperty="dan" viewProperty="birthday" format="dd/MM/yyyy" />
			<key beanProperty="email" viewProperty="mail" />
			<key beanProperty="civilite" viewProperty="civilite" />
			<key beanProperty="nbAnneeExp" viewProperty="nbAnneeExp" />
			<key beanProperty="natureDemande" viewProperty="natureDemande" />
			<key beanProperty="Cv" viewProperty="cv" />
		</mapping>
		
		<mapping isSame="false" ref-bean="AdminBeanIn" ref-view="viewI">
			<key beanProperty="login_admin" viewProperty="login" />
			<key beanProperty="password_admin" viewProperty="pass" />
		</mapping>

		<mapping isSame="false" ref-bean="BeanUser" ref-view="Data">
		    <key beanProperty="idUser" viewProperty="idCandidat" />
			<key beanProperty="path" viewProperty="pathCv" />
		</mapping>

	</mapping-view-bean>

	<!-- validators package -->

	<validators-package>
		<validator name="val1" typeVal="file" valueTarget="Recrut_val.xml" />
		<validator name="val2" typeVal="class"
			valueTarget="org.zerocouplage.application.web.validateClass.RecrutValidation" />
		<validator name="Adminvalidator" typeVal="class"
			valueTarget="org.zerocouplage.application.web.validateClass.AdminValidate" />
	</validators-package>

	<!-- beans-package -->

	<beans-package>
		<bean name="AdminBeanIn" class="org.zerocouplage.application.web.bean.AdminBeanIn" />
		<bean name="UserBeanIn" class="org.zerocouplage.application.web.bean.userBeanIn" />
		<bean name="BeanUser" class="org.zerocouplage.application.web.bean.BeanUser" />
	</beans-package>

	<!-- Business package -->

	<business-package>

		<business name="processing"
			class="org.zerocouplage.application.web.business.RecrutBusiness"
			method="process1">
			<bean-ref ref-bean="AdminBeanIn" />
			<validators-refs>
<!-- 				<validator-ref ref-val="Adminvalidator" /> -->
			</validators-refs>
			<view-results>
				<view-result name="success" bean-result="outt" ref-view="Data" />
			</view-results>
		</business>
		<business name="showData"
			class="org.zerocouplage.application.web.business.RecrutBusiness"
			method="getData">
			<view-results>
				<view-result name="success" ref-view="Data" />
			</view-results>
		</business>

		<business name="showCv"
			class="org.zerocouplage.application.web.business.RecrutBusiness"
			method="openFile">
			<bean-ref ref-bean="BeanUser" />
			<view-results>
				<view-result name="success" bean-result="fileResult"
					ref-view="test" />
			</view-results>
		</business>

		<business name="deleteCandidat"
			class="org.zerocouplage.application.web.business.RecrutBusiness"
			method="deleteCandidat">
			<bean-ref ref-bean="BeanUser" />
			<view-results>
				<view-result name="success" ref-view="Data" />
				<view-result name="error" ref-view="viewEmptyBD" />
			</view-results>
		</business>

		<business name="return">
			<view-results>
				<view-result name="success" ref-view="viewAccueil" />
			</view-results>
		</business>
		<business name="bdVide">
			<view-results>
				<view-result name="success" ref-view="emptyBd" />
			</view-results>
		</business>
		<business name="Formprocessing"
			class="org.zerocouplage.application.web.business.RecrutBusiness" method="Formprocess">
			<bean-ref ref-bean="BeanUser" />
			<validators-refs>
				<validator-ref ref-val="val1" />
				<validator-ref ref-val="val2" />
			</validators-refs>
			<view-results>
				<view-result name="success" bean-result="userout"
					ref-view="viewFormResult" />
			</view-results>
		</business>

		<business name="return">
			<view-results>
				<view-result ref-view="viewAccueil" />
			</view-results>
		</business>

		<business name="processingformulaire">
			<view-results>
				<view-result ref-view="viewFormCandidature" />
			</view-results>
		</business>

		<business name="processingcandidat">
			<view-results>
				<view-result ref-view="viewI" />
			</view-results>
		</business>

	</business-package>

	<!-- Views package -->

	<views-package>

		<view name="viewR" method="" methodError="" target="adminResult.jsp" />

		<view name="viewI" method="" methodError="" target="admin.jsp" />

		<view name="returnn" method="" methodError="" target="formulaire.jsp" />

		<view name="viewAccueil" method="" target="Accueil.jsp" />

		<view name="Data" method="" methodError="" target="DataAccess.jsp" />

		<view name="File" method="" methodError="" target="ShowFile.jsp" />

		<view name="emptyBd" method="" methodError="" target="EmptyBD.jsp" />

		<view name="viewFormCandidature" method="" methodError=""
			target="FormCandidature.jsp" />

		<view name="viewFormResult" method="" methodError=""
			target="FormResult.jsp" />

		<view name="viewAccueil" method="" methodError="" target="Accueil.jsp" />

		<view name="test" method="" methodError="" target="test.jsp" />

	</views-package>

	<!-- Add packages here -->

</zcouplage>